03:49:04.964390 IP localhost.localdomain.ssh > 192.168.0.3.61061: Flags [P.], seq 3005428736:3005428976, ack 3929558742, win 325, length 240
03:49:04.964560 IP 192.168.0.3.61061 > localhost.localdomain.ssh: Flags [.], ack 240, win 952, length 0
03:49:04.964963 IP localhost.localdomain.56032 > web.setup.domain: 12420+ PTR? 3.0.168.192.in-addr.arpa. (42)
03:49:04.966028 IP web.setup.domain > localhost.localdomain.56032: 12420 ServFail 0/0/0 (42)
03:49:04.966113 IP localhost.localdomain.46149 > web.setup.domain: 12420+ PTR? 3.0.168.192.in-addr.arpa. (42)
03:49:04.967086 IP web.setup.domain > localhost.localdomain.46149: 12420 ServFail 0/0/0 (42)
03:49:04.968274 IP localhost.localdomain.51026 > web.setup.domain: 32136+ PTR? 10.0.168.192.in-addr.arpa. (43)
03:49:04.969339 IP web.setup.domain > localhost.localdomain.51026: 32136 ServFail 0/0/0 (43)
03:49:04.969408 IP localhost.localdomain.34300 > web.setup.domain: 32136+ PTR? 10.0.168.192.in-addr.arpa. (43)
03:49:04.970432 IP web.setup.domain > localhost.localdomain.34300: 32136 ServFail 0/0/0 (43)
03:49:04.970663 IP localhost.localdomain.50135 > web.setup.domain: 49609+ PTR? 1.0.168.192.in-addr.arpa. (42)
03:49:04.971608 IP web.setup.domain > localhost.localdomain.50135: 49609 1/0/0 PTR web.setup. (65)
03:49:05.217562 IP 192.168.0.3.54915 > 192.168.255.255.54915: UDP, length 263
03:49:05.218024 IP localhost.localdomain.43478 > web.setup.domain: 31975+ PTR? 255.255.168.192.in-addr.arpa. (46)
03:49:05.225638 IP web.setup.domain > localhost.localdomain.43478: 31975 NXDomain 0/0/0 (46)
03:49:05.345821 IP6 fe80::70b9:858c:9475:96aa.62464 > ff02::c.ssdp: UDP, length 146
03:49:05.346111 IP localhost.localdomain.37892 > web.setup.domain: 58718+ PTR? c.0.0.0.0.0.0.0.0.0.0.0.0.0.0.0.0.0.0.0.0.0.0.0.0.0.0.0.2.0.f.f.ip6.arpa. (90)
03:49:05.353271 IP web.setup.domain > localhost.localdomain.37892: 58718 NXDomain 0/1/0 (160)
03:49:05.353687 IP localhost.localdomain.57334 > web.setup.domain: 33525+ PTR? a.a.6.9.5.7.4.9.c.8.5.8.9.b.0.7.0.0.0.0.0.0.0.0.0.0.0.0.0.8.e.f.ip6.arpa. (90)
03:49:05.363240 IP web.setup.domain > localhost.localdomain.57334: 33525 NXDomain 0/0/0 (90)
03:49:06.212144 IP 192.168.0.3.54915 > 192.168.255.255.54915: UDP, length 263
03:49:06.241154 IP 192.168.0.3.55484 > web.setup.icslap: Flags [S], seq 1473865483, win 8192, options [mss 1460,nop,wscale 8,nop,nop,sackOK], length 0
03:49:06.241806 IP web.setup.icslap > 192.168.0.3.55484: Flags [S.], seq 2331180383, ack 1473865484, win 16384, options [mss 1460,nop,wscale 0], length 0
03:49:06.241815 IP 192.168.0.3.55484 > web.setup.icslap: Flags [.], ack 1, win 256, length 0
03:49:06.242035 IP 192.168.0.3.55484 > web.setup.icslap: Flags [P.], seq 1:328, ack 1, win 256, length 327
03:49:06.242181 IP 192.168.0.3.55484 > web.setup.icslap: Flags [P.], seq 328:637, ack 1, win 256, length 309
03:49:06.242956 IP web.setup.icslap > 192.168.0.3.55484: Flags [.], ack 637, win 16884, length 0
03:49:06.245508 IP web.setup.icslap > 192.168.0.3.55484: Flags [P.], seq 1:556, ack 637, win 17520, length 555
03:49:06.245954 IP web.setup.icslap > 192.168.0.3.55484: Flags [F.], seq 556, ack 637, win 17520, length 0
03:49:06.245999 IP 192.168.0.3.55484 > web.setup.icslap: Flags [.], ack 557, win 254, length 0
03:49:06.257695 IP 192.168.0.3.55484 > web.setup.icslap: Flags [F.], seq 637, ack 557, win 254, length 0
03:49:06.258465 IP web.setup.icslap > 192.168.0.3.55484: Flags [.], ack 638, win 17520, length 0
03:49:06.259237 IP 192.168.0.3.55485 > web.setup.icslap: Flags [S], seq 1731293498, win 8192, options [mss 1460,nop,wscale 8,nop,nop,sackOK], length 0
03:49:06.259823 IP web.setup.icslap > 192.168.0.3.55485: Flags [S.], seq 2334538519, ack 1731293499, win 16384, options [mss 1460,nop,wscale 0], length 0
03:49:06.259869 IP 192.168.0.3.55485 > web.setup.icslap: Flags [.], ack 1, win 256, length 0
03:49:06.259959 IP 192.168.0.3.55485 > web.setup.icslap: Flags [P.], seq 1:332, ack 1, win 256, length 331
03:49:06.259962 IP 192.168.0.3.55485 > web.setup.icslap: Flags [P.], seq 332:645, ack 1, win 256, length 313
03:49:06.260805 IP web.setup.icslap > 192.168.0.3.55485: Flags [.], ack 645, win 16876, length 0
03:49:06.263472 IP web.setup.icslap > 192.168.0.3.55485: Flags [P.], seq 1:572, ack 645, win 17520, length 571
03:49:06.263520 IP 192.168.0.3.55485 > web.setup.icslap: Flags [F.], seq 645, ack 572, win 254, length 0
03:49:06.263991 IP web.setup.icslap > 192.168.0.3.55485: Flags [F.], seq 572, ack 645, win 17520, length 0
03:49:06.263999 IP 192.168.0.3.55485 > web.setup.icslap: Flags [.], ack 573, win 254, length 0
03:49:06.264216 IP web.setup.icslap > 192.168.0.3.55485: Flags [.], ack 646, win 17520, length 0
03:49:06.392163 ARP, Request who-has web.setup tell 192.168.0.6, length 46
03:49:06.392405 IP localhost.localdomain.36745 > web.setup.domain: 51960+ PTR? 6.0.168.192.in-addr.arpa. (42)
03:49:06.393574 IP web.setup.domain > localhost.localdomain.36745: 51960 ServFail 0/0/0 (42)
03:49:06.393757 IP localhost.localdomain.39759 > web.setup.domain: 51960+ PTR? 6.0.168.192.in-addr.arpa. (42)
03:49:06.394788 IP web.setup.domain > localhost.localdomain.39759: 51960 ServFail 0/0/0 (42)
03:49:07.218856 IP 192.168.0.3.54915 > 192.168.255.255.54915: UDP, length 263
03:49:08.034414 IP 192.168.0.3.51169 > 104.244.42.1.https: Flags [.], seq 188469830:188469831, ack 3455865315, win 254, length 1
03:49:08.034822 IP localhost.localdomain.59600 > web.setup.domain: 55142+ PTR? 1.42.244.104.in-addr.arpa. (43)
03:49:08.069156 IP 192.168.0.3.38457 > 64.4.23.145.40024: UDP, length 32
03:49:08.137463 IP 104.244.42.1.https > 192.168.0.3.51169: Flags [.], ack 1, win 2521, options [nop,nop,sack 1 {0:1}], length 0
03:49:08.187944 IP 64.4.23.145.40024 > 192.168.0.3.38457: UDP, length 20
03:49:08.210647 IP 192.168.0.3.54915 > 192.168.255.255.54915: UDP, length 263
03:49:08.265921 IP 192.168.0.3.55486 > web.setup.icslap: Flags [S], seq 3186734065, win 8192, options [mss 1460,nop,wscale 8,nop,nop,sackOK], length 0
03:49:08.266462 IP web.setup.icslap > 192.168.0.3.55486: Flags [S.], seq 2419198406, ack 3186734066, win 16384, options [mss 1460,nop,wscale 0], length 0
03:49:08.266590 IP 192.168.0.3.55486 > web.setup.icslap: Flags [.], ack 1, win 256, length 0
03:49:08.266807 IP 192.168.0.3.55486 > web.setup.icslap: Flags [P.], seq 1:328, ack 1, win 256, length 327
03:49:08.266914 IP 192.168.0.3.55486 > web.setup.icslap: Flags [P.], seq 328:637, ack 1, win 256, length 309
03:49:08.267531 IP web.setup.icslap > 192.168.0.3.55486: Flags [.], ack 637, win 16884, length 0
03:49:08.269602 IP web.setup.icslap > 192.168.0.3.55486: Flags [P.], seq 1:556, ack 637, win 17520, length 555
03:49:08.269643 IP 192.168.0.3.55486 > web.setup.icslap: Flags [F.], seq 637, ack 556, win 254, length 0
03:49:08.270722 IP web.setup.icslap > 192.168.0.3.55486: Flags [.], ack 638, win 17520, length 0
03:49:08.270729 IP web.setup.icslap > 192.168.0.3.55486: Flags [F.], seq 556, ack 638, win 17520, length 0
03:49:08.270731 IP 192.168.0.3.55486 > web.setup.icslap: Flags [.], ack 557, win 254, length 0
03:49:08.270966 IP 192.168.0.3.55487 > web.setup.icslap: Flags [S], seq 2376264199, win 8192, options [mss 1460,nop,wscale 8,nop,nop,sackOK], length 0
03:49:08.271653 IP web.setup.icslap > 192.168.0.3.55487: Flags [S.], seq 2435929678, ack 2376264200, win 16384, options [mss 1460,nop,wscale 0], length 0
03:49:08.271658 IP 192.168.0.3.55487 > web.setup.icslap: Flags [.], ack 1, win 256, length 0
03:49:08.271729 IP 192.168.0.3.55487 > web.setup.icslap: Flags [P.], seq 1:332, ack 1, win 256, length 331
03:49:08.271765 IP 192.168.0.3.55487 > web.setup.icslap: Flags [P.], seq 332:645, ack 1, win 256, length 313
03:49:08.272645 IP web.setup.icslap > 192.168.0.3.55487: Flags [.], ack 645, win 16876, length 0
03:49:08.275025 IP web.setup.icslap > 192.168.0.3.55487: Flags [P.], seq 1:572, ack 645, win 17520, length 571
03:49:08.275031 IP 192.168.0.3.55487 > web.setup.icslap: Flags [F.], seq 645, ack 572, win 254, length 0
03:49:08.275548 IP web.setup.icslap > 192.168.0.3.55487: Flags [F.], seq 572, ack 645, win 17520, length 0
03:49:08.275552 IP 192.168.0.3.55487 > web.setup.icslap: Flags [.], ack 573, win 254, length 0
03:49:08.275893 IP web.setup.icslap > 192.168.0.3.55487: Flags [.], ack 646, win 17520, length 0
03:49:08.286219 IP web.setup.domain > localhost.localdomain.59600: 55142 ServFail 0/0/0 (43)
03:49:08.286492 IP localhost.localdomain.55552 > web.setup.domain: 55142+ PTR? 1.42.244.104.in-addr.arpa. (43)
03:49:08.346052 IP6 fe80::70b9:858c:9475:96aa.62464 > ff02::c.ssdp: UDP, length 146
03:49:08.524813 IP localhost.localdomain.58270 > web.setup.domain: 39595+ PTR? 145.23.4.64.in-addr.arpa. (42)
03:49:08.533534 IP web.setup.domain > localhost.localdomain.58270: 39595 NXDomain 0/1/0 (110)
03:49:09.213118 IP 192.168.0.3.54915 > 192.168.255.255.54915: UDP, length 263
03:49:09.996014 IP 192.168.0.3.54433 > 157.56.144.215.teredo: UDP, length 61
03:49:09.996227 IP localhost.localdomain.40012 > web.setup.domain: 40954+ PTR? 215.144.56.157.in-addr.arpa. (45)
03:49:10.004377 IP web.setup.domain > localhost.localdomain.40012: 40954 NXDomain 0/1/0 (113)
03:49:10.165511 IP 157.56.144.215.teredo > 192.168.0.3.54433: UDP, length 109
03:49:10.204220 IP 192.168.0.3.54915 > 192.168.255.255.54915: UDP, length 263
03:49:10.276446 IP 192.168.0.3.55488 > web.setup.icslap: Flags [S], seq 3848166244, win 8192, options [mss 1460,nop,wscale 8,nop,nop,sackOK], length 0
03:49:10.276995 IP web.setup.icslap > 192.168.0.3.55488: Flags [S.], seq 2518732895, ack 3848166245, win 16384, options [mss 1460,nop,wscale 0], length 0
03:49:10.277090 IP 192.168.0.3.55488 > web.setup.icslap: Flags [.], ack 1, win 256, length 0
03:49:10.277168 IP 192.168.0.3.55488 > web.setup.icslap: Flags [P.], seq 1:328, ack 1, win 256, length 327
03:49:10.277209 IP 192.168.0.3.55488 > web.setup.icslap: Flags [P.], seq 328:637, ack 1, win 256, length 309
03:49:10.278085 IP web.setup.icslap > 192.168.0.3.55488: Flags [.], ack 637, win 16884, length 0
03:49:10.280186 IP web.setup.icslap > 192.168.0.3.55488: Flags [P.], seq 1:556, ack 637, win 17520, length 555
03:49:10.280239 IP 192.168.0.3.55488 > web.setup.icslap: Flags [F.], seq 637, ack 556, win 254, length 0
03:49:10.280751 IP web.setup.icslap > 192.168.0.3.55488: Flags [F.], seq 556, ack 637, win 17520, length 0
03:49:10.280758 IP 192.168.0.3.55488 > web.setup.icslap: Flags [.], ack 557, win 254, length 0
03:49:10.281589 IP web.setup.icslap > 192.168.0.3.55488: Flags [.], ack 638, win 17520, length 0
03:49:10.281684 IP 192.168.0.3.55489 > web.setup.icslap: Flags [S], seq 178886255, win 8192, options [mss 1460,nop,wscale 8,nop,nop,sackOK], length 0
03:49:10.282354 IP web.setup.icslap > 192.168.0.3.55489: Flags [S.], seq 2547427857, ack 178886256, win 16384, options [mss 1460,nop,wscale 0], length 0
03:49:10.282364 IP 192.168.0.3.55489 > web.setup.icslap: Flags [.], ack 1, win 256, length 0
03:49:10.282543 IP 192.168.0.3.55489 > web.setup.icslap: Flags [P.], seq 1:332, ack 1, win 256, length 331
03:49:10.282610 IP 192.168.0.3.55489 > web.setup.icslap: Flags [P.], seq 332:645, ack 1, win 256, length 313
03:49:10.283454 IP web.setup.icslap > 192.168.0.3.55489: Flags [.], ack 645, win 16876, length 0
03:49:10.286535 IP web.setup.icslap > 192.168.0.3.55489: Flags [P.], seq 1:572, ack 645, win 17520, length 571
03:49:10.286578 IP 192.168.0.3.55489 > web.setup.icslap: Flags [F.], seq 645, ack 572, win 254, length 0
03:49:10.287037 IP web.setup.icslap > 192.168.0.3.55489: Flags [F.], seq 572, ack 645, win 17520, length 0
03:49:10.287044 IP 192.168.0.3.55489 > web.setup.icslap: Flags [.], ack 573, win 254, length 0
03:49:10.287562 IP web.setup.icslap > 192.168.0.3.55489: Flags [.], ack 646, win 17520, length 0
03:49:10.611759 IP r-199-59-148-241.twttr.com.https > 192.168.0.3.60765: Flags [P.], seq 2916414049:2916414081, ack 711453456, win 126, length 32
03:49:10.612002 IP localhost.localdomain.50151 > web.setup.domain: 49895+ PTR? 241.148.59.199.in-addr.arpa. (45)
03:49:10.612250 IP r-199-59-148-241.twttr.com.https > 192.168.0.3.60765: Flags [P.], seq 32:100, ack 1, win 126, length 68
03:49:10.612259 IP 192.168.0.3.60765 > r-199-59-148-241.twttr.com.https: Flags [.], ack 100, win 251, length 0
03:49:10.624876 IP web.setup.domain > localhost.localdomain.50