09:48:26.614183 IP localhost.localdomain > 192.168.0.3: ICMP echo request, id 14730, seq 1, length 64
09:48:27.614367 IP localhost.localdomain > 192.168.0.3: ICMP echo request, id 14730, seq 2, length 64
09:48:28.614693 IP localhost.localdomain > 192.168.0.3: ICMP echo request, id 14730, seq 3, length 64
09:48:29.614749 IP localhost.localdomain > 192.168.0.3: ICMP echo request, id 14730, seq 4, length 64
09:48:30.615064 IP localhost.localdomain > 192.168.0.3: ICMP echo request, id 14730, seq 5, length 64
09:48:31.616205 IP localhost.localdomain > 192.168.0.3: ICMP echo request, id 14730, seq 6, length 64
09:48:32.616053 IP localhost.localdomain > 192.168.0.3: ICMP echo request, id 14730, seq 7, length 64
09:48:33.615967 IP localhost.localdomain > 192.168.0.3: ICMP echo request, id 14730, seq 8, length 64
09:48:34.615996 IP localhost.localdomain > 192.168.0.3: ICMP echo request, id 14730, seq 9, length 64
09:48:35.615854 IP localhost.localdomain > 192.168.0.3: ICMP echo request, id 14730, seq 10, length 64
09:48:36.615862 IP localhost.localdomain > 192.168.0.3: ICMP echo request, id 14730, seq 11, length 64
09:48:37.615606 IP localhost.localdomain > 192.168.0.3: ICMP echo request, id 14730, seq 12, length 64
09:48:38.615993 IP localhost.localdomain > 192.168.0.3: ICMP echo request, id 14730, seq 13, length 64
09:48:39.615897 IP localhost.localdomain > 192.168.0.3: ICMP echo request, id 14730, seq 14, length 64
09:48:40.615870 IP localhost.localdomain > 192.168.0.3: ICMP echo request, id 14730, seq 15, length 64
09:48:41.615848 IP localhost.localdomain > 192.168.0.3: ICMP echo request, id 14730, seq 16, length 64
09:48:42.615857 IP localhost.localdomain > 192.168.0.3: ICMP echo request, id 14730, seq 17, length 64
09:48:43.616030 IP localhost.localdomain > 192.168.0.3: ICMP echo request, id 14730, seq 18, length 64
09:48:44.615869 IP localhost.localdomain > 192.168.0.3: ICMP echo request, id 14730, seq 19, length 64
09:48:45.615888 IP localhost.localdomain > 192.168.0.3: ICMP echo request, id 14730, seq 20, length 64
09:48:46.615847 IP localhost.localdomain > 192.168.0.3: ICMP echo request, id 14730, seq 21, length 64
09:48:47.615838 IP localhost.localdomain > 192.168.0.3: ICMP echo request, id 14730, seq 22, length 64
09:48:48.615828 IP localhost.localdomain > 192.168.0.3: ICMP echo request, id 14730, seq 23, length 64
09:48:49.616043 IP localhost.localdomain > 192.168.0.3: ICMP echo request, id 14730, seq 24, length 64
09:48:50.616071 IP localhost.localdomain > 192.168.0.3: ICMP echo request, id 14730, seq 25, length 64
09:48:51.616011 IP localhost.localdomain > 192.168.0.3: ICMP echo request, id 14730, seq 26, length 64
09:48:52.615797 IP localhost.localdomain > 192.168.0.3: ICMP echo request, id 14730, seq 27, length 64
09:48:53.615645 IP localhost.localdomain > 192.168.0.3: ICMP echo request, id 14730, seq 28, length 64
09:48:54.615656 IP localhost.localdomain > 192.168.0.3: ICMP echo request, id 14730, seq 29, length 64
09:48:55.615669 IP localhost.localdomain > 192.168.0.3: ICMP echo request, id 14730, seq 30, length 64
09:48:56.616010 IP localhost.localdomain > 192.168.0.3: ICMP echo request, id 14730, seq 31, length 64
09:48:57.616082 IP localhost.localdomain > 192.168.0.3: ICMP echo request, id 14730, seq 32, length 64
09:48:58.615927 IP localhost.localdomain > 192.168.0.3: ICMP echo request, id 14730, seq 33, length 64
09:48:59.616013 IP localhost.localdomain > 192.168.0.3: ICMP echo request, id 14730, seq 34, length 64
09:49:00.616076 IP localhost.localdomain > 192.168.0.3: ICMP echo request, id 14730, seq 35, length 64
09:49:01.616536 IP localhost.localdomain > 192.168.0.3: ICMP echo request, id 14730, seq 36, length 64
09:49:02.616912 IP localhost.localdomain > 192.168.0.3: ICMP echo request, id 14730, seq 37, length 64
09:49:03.617067 IP localhost.localdomain > 192.168.0.3: ICMP echo request, id 14730, seq 38, length 64
09:49:04.616754 IP localhost.localdomain > 192.168.0.3: ICMP echo request, id 14730, seq 39, length 64
09:49:05.616891 IP localhost.localdomain > 192.168.0.3: ICMP echo request, id 14730, seq 40, length 64
09:49:06.616777 IP localhost.localdomain > 192.168.0.3: ICMP echo request, id 14730, seq 41, length 64
09:49:07.616681 IP localhost.localdomain > 192.168.0.3: ICMP echo request, id 14730, seq 42, length 64
09:49:08.616685 IP localhost.localdomain > 192.168.0.3: ICMP echo request, id 14730, seq 43, length 64
09:49:09.616772 IP localhost.localdomain > 192.168.0.3: ICMP echo request, id 14730, seq 44, length 64
09:49:10.616707 IP localhost.localdomain > 192.168.0.3: ICMP echo request, id 14730, seq 45, length 64
09:49:11.617477 IP localhost.localdomain > 192.168.0.3: ICMP echo request, id 14730, seq 46, length 64
09:49:12.617914 IP localhost.localdomain > 192.168.0.3: ICMP echo request, id 14730, seq 47, length 64
09:49:13.618056 IP localhost.localdomain > 192.168.0.3: ICMP echo request, id 14730, seq 48, length 64
09:49:14.618053 IP localhost.localdomain > 192.168.0.3: ICMP echo request, id 14730, seq 49, length 64
09:49:15.617810 IP localhost.localdomain > 192.168.0.3: ICMP echo request, id 14730, seq 50, length 64
09:49:16.617930 IP localhost.localdomain > 192.168.0.3: ICMP echo request, id 14730, seq 51, length 64
09:49:17.617710 IP localhost.localdomain > 192.168.0.3: ICMP echo request, id 14730, seq 52, length 64
09:49:18.617657 IP localhost.localdomain > 192.168.0.3: ICMP echo request, id 14730, seq 53, length 64
09:49:19.617831 IP localhost.localdomain > 192.168.0.3: ICMP echo request, id 14730, seq 54, length 64
09:49:20.617754 IP localhost.localdomain > 192.168.0.3: ICMP echo request, id 14730, seq 55, length 64
09:49:21.617663 IP localhost.localdomain > 192.168.0.3: ICMP echo request, id 14730, seq 56, length 64
09:49:22.617824 IP localhost.localdomain > 192.168.0.3: ICMP echo request, id 14730, seq 57, length 64
09:49:23.617730 IP localhost.localdomain > 192.168.0.3: ICMP echo request, id 14730, seq 58, length 64
09:49:24.617660 IP localhost.localdomain > 192.168.0.3: ICMP echo request, id 14730, seq 59, length 64
09:49:25.617923 IP localhost.localdomain > 192.168.0.3: ICMP echo request, id 14730, seq 60, length 64
09:49:26.617656 IP localhost.localdomain > 192.168.0.3: ICMP echo request, id 14730, seq 61, length 64
09:49:27.617685 IP localhost.localdomain > 192.168.0.3: ICMP echo request, id 14730, seq 62, length 64
09:49:28.617747 IP localhost.localdomain > 192.168.0.3: ICMP echo request, id 14730, seq 63, length 64
09:49:29.617994 IP localhost.localdomain > 192.168.0.3: ICMP echo request, id 14730, seq 64, length 64
09:49:30.617753 IP localhost.localdomain > 192.168.0.3: ICMP echo request, id 14730, seq 65, length 64
09:49:31.617921 IP localhost.localdomain > 192.168.0.3: ICMP echo request, id 14730, seq 66, length 64
09:49:32.618074 IP localhost.localdomain > 192.168.0.3: ICMP echo request, id 14730, seq 67, length 64
09:49:33.617971 IP localhost.localdomain > 192.168.0.3: ICMP echo request, id 14730, seq 68, length 64
09:49:34.618028 IP localhost.localdomain > 192.168.0.3: ICMP echo request, id 14730, seq 69, length 64
09:49:35.617967 IP localhost.localdomain > 192.168.0.3: ICMP echo request, id 14730, seq 70, length 64
09:49:36.618094 IP localhost.localdomain > 192.168.0.3: ICMP echo request, id 14730, seq 71, length 64
09:49:37.617807 IP localhost.localdomain > 192.168.0.3: ICMP echo request, id 14730, seq 72, length 64
09:49:38.724190 IP localhost.localdomain > 192.168.0.3: ICMP echo request, id 14760, seq 1, length 64
09:49:39.723854 IP localhost.localdomain > 192.168.0.3: ICMP echo request, id 14760, seq 2, length 64
09:49:40.723926 IP localhost.localdomain > 192.168.0.3: ICMP echo request, id 14760, seq 3, length 64
09:49:41.724062 IP localhost.localdomain > 192.168.0.3: ICMP echo request, id 14760, seq 4, length 64
09:49:42.724013 IP localhost.localdomain > 192.168.0.3: ICMP echo request, id 14760, seq 5, length 64
09:49:43.723894 IP localhost.localdomain > 192.168.0.3: ICMP echo request, id 14760, seq 6, length 64
09:49:44.723726 IP localhost.localdomain > 192.168.0.3: ICMP echo request, id 14760, seq 7, length 64
09:49:45.723971 IP localhost.localdomain > 192.168.0.3: ICMP echo request, id 14760, seq 8, length 64
09:49:46.723626 IP localhost.localdomain > 192.168.0.3: ICMP echo request, id 14760, seq 9, length 64
09:49:47.724006 IP localhost.localdomain > 192.168.0.3: ICMP echo request, id 14760, seq 10, length 64
09:49:48.723957 IP localhost.localdomain > 192.168.0.3: ICMP echo request, id 14760, seq 11, length 64
09:49:49.723783 IP localhost.localdomain > 192.168.0.3: ICMP echo request, id 14760, seq 12, length 64
09:49:50.723958 IP localhost.localdomain > 192.168.0.3: ICMP echo request, id 14760, seq 13, length 64
09:49:51.723700 IP localhost.localdomain > 192.168.0.3: ICMP echo request, id 14760, seq 14, length 64
09:49:52.723915 IP localhost.localdomain > 192.168.0.3: ICMP echo request, id 14760, seq 15, length 64
09:49:53.820259 IP localhost.localdomain > 192.168.0.3: ICMP echo request, id 14761, seq 1, length 64
09:49:54.819695 IP localhost.localdomain > 192.168.0.3: ICMP echo request, id 14761, seq 2, length 64
09:49:55.819715 IP localhost.localdomain > 192.168.0.3: ICMP echo request, id 14761, seq 3, length 64
09:49:56.820007 IP localhost.localdomain > 192.168.0.3: ICMP echo request, id 14761, seq 4, length 64
09:49:57.819865 IP localhost.localdomain > 192.168.0.3: ICMP echo request, id 14761, seq 5, length 64
09:50:13.493411 IP localhost.localdomain > 192.168.0.3: ICMP echo request, id 14764, seq 1, length 64
09:50:14.494068 IP localhost.localdomain > 192.168.0.3: ICMP echo request, id 14764, seq 2, length 64
09:50:15.493981 IP localhost.localdomain > 192.168.0.3: ICMP echo request, id 14764, seq 3, length 64
09:50:16.493934 IP localhost.localdomain > 192.168.0.3: ICMP echo request, id 14764, seq 4, length 64
09:50:17.494109 IP localhost.localdomain > 192.168.0.3: ICMP echo request, id 14764, seq 5, length 64
09:50:18.493667 IP localhost.localdomain > 192.168.0.3: ICMP echo request, id 14764, seq 6, length 64
09:50:19.493956 IP localhost.localdomain > 192.168.0.3: ICMP echo request, id 14764, seq 7, length 64
09:50:20.493910 IP localhost.localdomain > 192.168.0.3: ICMP echo request, id 14764, seq 8, length 64
09:50:21.493811 IP localhost.localdomain > 192.168.0.3: ICMP echo request, id 14764, seq 9, length 64
09:50:22.493727 IP localhost.localdomain > 192.168.0.3: ICMP echo request, id 14764, seq 10, length 64
09:50:23.493793 IP localhost.localdomain > 192.168.0.3: ICMP echo request, id 14764, seq 11, length 64
09:50:24.493916 IP localhost.localdomain > 192.168.0.3: ICMP echo request, id 14764, seq 12, length 64
09:50:25.493774 IP localhost.localdomain > 192.168.0.3: ICMP echo request, id 14764, seq 13, length 64
09:50:26.493830 IP localhost.localdomain > 192.168.0.3: ICMP echo request, id 14764, seq 14, length 64
09:50:27.493619 IP localhost.localdomain > 192.168.0.3: ICMP echo request, id 14764, seq 15, length 64
09:50:28.493698 IP localhost.localdomain > 192.168.0.3: ICMP echo request, id 14764, seq 16, length 64
09:50:29.493646 IP localhost.localdomain > 192.168.0.3: ICMP echo request, id 14764, seq 17, length 64
09:50:30.493936 IP localhost.localdomain > 192.168.0.3: ICMP echo request, id 14764, seq 18, length 64
09:50:31.493845 IP localhost.localdomain > 192.168.0.3: ICMP echo request, id 14764, seq 19, length 64
09:50:32.493883 IP localhost.localdomain > 192.168.0.3: ICMP echo request, id 14764, seq 20, length 64
09:50:33.493990 IP localhost.localdomain > 192.168.0.3: ICMP echo request, id 14764, seq 21, length 64
09:50:34.493838 IP localhost.localdomain > 192.168.0.3: ICMP echo request, id 14764, seq 22, length 64
09:50:35.494096 IP localhost.localdomain > 192.168.0.3: ICMP echo request, id 14764, seq 23, length 64
09:50:36.493792 IP localhost.localdomain > 192.168.0.3: ICMP echo request, id 14764, seq 24, length 64
09:50:37.493900 IP localhost.localdomain > 192.168.0.3: ICMP echo request, id 14764, seq 25, length 64
09:50:38.493683 IP localhost.localdomain > 192.168.0.3: ICMP echo request, id 14764, seq 26, length 64
09:50:39.493886 IP localhost.localdomain > 192.168.0.3: ICMP echo request, id 14764, seq 27, length 64
09:50:40.493905 IP localhost.localdomain > 192.168.0.3: ICMP echo request, id 14764, seq 28, length 64
09:50:41.494185 IP localhost.localdomain > 192.168.0.3: ICMP echo request, id 14764, seq 29, length 64
09:50:42.493722 IP localhost.localdomain > 192.168.0.3: ICMP echo request, id 14764, seq 30, length 64
09:50:43.493892 IP localhost.localdomain > 192.168.0.3: ICMP echo request, id 14764, seq 31, length 64
09:50:44.493874 IP localhost.localdomain > 192.168.0.3: ICMP echo request, id 14764, seq 32, length 64
09:50:45.493801 IP localhost.localdomain > 192.168.0.3: ICMP echo request, id 14764, seq 33, length 64
09:50:46.493997 IP localhost.localdomain > 192.168.0.3: ICMP echo request, id 14764, seq 34, length 64
09:50:47.493727 IP localhost.localdomain > 192.168.0.3: ICMP echo request, id 14764, seq 35, length 64
09:50:48.494309 IP localhost.localdomain > 192.168.0.3: ICMP echo request, id 14764, seq 36, length 64
09:50:49.493876 IP localhost.localdomain > 192.168.0.3: ICMP echo request, id 14764, seq 37, length 64
09:50:50.493960 IP localhost.localdomain > 192.168.0.3: ICMP echo request, id 14764, seq 38, length 64
09:50:51.494006 IP localhost.localdomain > 192.168.0.3: ICMP echo request, id 14764, seq 39, length 64
09:50:52.494116 IP localhost.localdomain > 192.168.0.3: ICMP echo request, id 14764, seq 40, length 64
09:50:53.493873 IP localhost.localdomain > 192.168.0.3: ICMP echo request, id 14764, seq 41, length 64
09:50:54.495525 IP localhost.localdomain > 192.168.0.3: ICMP echo request, id 14764, seq 42, length 64
09:50:55.495939 IP localhost.localdomain > 192.168.0.3: ICMP echo request, id 14764, seq 43, length 64
09:50:56.496106 IP localhost.localdomain > 192.168.0.3: ICMP echo request, id 14764, seq 44, length 64
09:50:57.495801 IP localhost.localdomain > 192.168.0.3: ICMP echo request, id 14764, seq 45, length 64
09:50:58.496058 IP localhost.localdomain > 192.168.0.3: ICMP echo request, id 14764, seq 46, length 64
09:50:59.496252 IP localhost.localdomain > 192.168.0.3: ICMP echo request, id 14764, seq 47, length 64
09:51:00.496063 IP localhost.localdomain > 192.168.0.3: ICMP echo request, id 14764, seq 48, length 64
09:51:01.495797 IP localhost.localdomain > 192.168.0.3: ICMP echo request, id 14764, seq 49, length 64
09:51:02.495977 IP localhost.localdomain > 192.168.0.3: ICMP echo request, id 14764, seq 50, length 64
09:51:03.495672 IP localhost.localdomain > 192.168.0.3: ICMP echo request, id 14764, seq 51, length 64
09:51:04.495729 IP localhost.localdomain > 192.168.0.3: ICMP echo request, id 14764, seq 52, length 64
09:51:05.496202 IP localhost.localdomain > 192.168.0.3: ICMP echo request, id 14764, seq 53, length 64
09:51:06.495996 IP localhost.localdomain > 192.168.0.3: ICMP echo request, id 14764, seq 54, length 64
09:51:07.495832 IP localhost.localdomain > 192.168.0.3: ICMP echo request, id 14764, seq 55, length 64
09:51:08.495789 IP localhost.localdomain > 192.168.0.3: ICMP echo request, id 14764, seq 56, length 64
09:51:09.495853 IP localhost.localdomain > 192.168.0.3: ICMP echo request, id 14764, seq 57, length 64
09:51:10.496031 IP localhost.localdomain > 192.168.0.3: ICMP echo request, id 14764, seq 58, length 64
09:51:11.495592 IP localhost.localdomain > 192.168.0.3: ICMP echo request, id 14764, seq 59, length 64
09:51:12.496108 IP localhost.localdomain > 192.168.0.3: ICMP echo request, id 14764, seq 60, length 64
09:51:13.496617 IP localhost.localdomain > 192.168.0.3: ICMP echo request, id 14764, seq 61, length 64
09:51:14.497018 IP localhost.localdomain > 192.168.0.3: ICMP echo request, id 14764, seq 62, length 64
09:51:15.497113 IP localhost.localdomain > 192.168.0.3: ICMP echo request, id 14764, seq 63, length 64
09:51:16.496665 IP localhost.localdomain > 192.168.0.3: ICMP echo request, id 14764, seq 64, length 64
09:51:17.496729 IP localhost.localdomain > 192.168.0.3: ICMP echo request, id 14764, seq 65, length 64
09:51:18.496975 IP localhost.localdomain > 192.168.0.3: ICMP echo request, id 14764, seq 66, length 64
09:51:19.497163 IP localhost.localdomain > 192.168.0.3: ICMP echo request, id 14764, seq 67, length 64
09:51:20.497024 IP localhost.localdomain > 192.168.0.3: ICMP echo request, id 14764, seq 68, length 64
09:51:21.496770 IP localhost.localdomain > 192.168.0.3: ICMP echo request, id 14764, seq 69, length 64
09:51:22.496907 IP localhost.localdomain > 192.168.0.3: ICMP echo request, id 14764, seq 70, length 64
09:51:23.496827 IP localhost.localdomain > 192.168.0.3: ICMP echo request, id 14764, seq 71, length 64
09:51:24.496997 IP localhost.localdomain > 192.168.0.3: ICMP echo request, id 14764, seq 72, length 64
09:51:25.497172 IP localhost.localdomain > 192.168.0.3: ICMP echo request, id 14764, seq 73, length 64
09:51:26.496690 IP localhost.localdomain > 192.168.0.3: ICMP echo request, id 14764, seq 74, length 64
09:51:27.496954 IP localhost.localdomain > 192.168.0.3: ICMP echo request, id 14764, seq 75, length 64
09:51:28.496875 IP localhost.localdomain > 192.168.0.3: ICMP echo request, id 14764, seq 76, length 64
09:51:29.497048 IP localhost.localdomain > 192.168.0.3: ICMP echo request, id 14764, seq 77, length 64
09:51:30.497072 IP localhost.localdomain > 192.168.0.3: ICMP echo request, id 14764, seq 78, length 64
09:51:31.496960 IP localhost.localdomain > 192.168.0.3: ICMP echo request, id 14764, seq 79, length 64
09:51:32.496743 IP localhost.localdomain > 192.168.0.3: ICMP echo request, id 14764, seq 80, length 64
09:51:33.496984 IP localhost.localdomain > 192.168.0.3: ICMP echo request, id 14764, seq 81, length 64
09:51:34.497157 IP localhost.localdomain > 192.168.0.3: ICMP echo request, id 14764, seq 82, length 64
09:51:35.497097 IP localhost.localdomain > 192.168.0.3: ICMP echo request, id 14764, seq 83, length 64
09:51:36.497632 IP localhost.localdomain > 192.168.0.3: ICMP echo request, id 14764, seq 84, length 64
09:51:37.497935 IP localhost.localdomain > 192.168.0.3: ICMP echo request, id 14764, seq 85, length 64
09:51:38.497644 IP localhost.localdomain > 192.168.0.3: ICMP echo request, id 14764, seq 86, length 64
09:51:39.497757 IP localhost.localdomain > 192.168.0.3: ICMP echo request, id 14764, seq 87, length 64
09:51:40.498105 IP localhost.localdomain > 192.168.0.3: ICMP echo request, id 14764, seq 88, length 64
09:51:41.497698 IP localhost.localdomain > 192.168.0.3: ICMP echo request, id 14764, seq 89, length 64
09:51:42.497853 IP localhost.localdomain > 192.168.0.3: ICMP echo request, id 14764, seq 90, length 64
09:51:43.498289 IP localhost.localdomain > 192.168.0.3: ICMP echo request, id 14764, seq 91, length 64
09:51:44.497743 IP localhost.localdomain > 192.168.0.3: ICMP echo request, id 14764, seq 92, length 64
09:51:45.497772 IP localhost.localdomain > 192.168.0.3: ICMP echo request, id 14764, seq 93, length 64
09:51:46.497748 IP localhost.localdomain > 192.168.0.3: ICMP echo request, id 14764, seq 94, length 64
09:51:47.497997 IP localhost.localdomain > 192.168.0.3: ICMP echo request, id 14764, seq 95, length 64
09:51:48.497931 IP localhost.localdomain > 192.168.0.3: ICMP echo request, id 14764, seq 96, length 64
09:51:49.497969 IP localhost.localdomain > 192.168.0.3: ICMP echo request, id 14764, seq 97, length 64
09:51:50.497659 IP localhost.localdomain > 192.168.0.3: ICMP echo request, id 14764, seq 98, length 64
09:51:51.498065 IP localhost.localdomain > 192.168.0.3: ICMP echo request, id 14764, seq 99, length 64
09:51:52.497841 IP localhost.localdomain > 192.168.0.3: ICMP echo request, id 14764, seq 100, length 64
09:51:53.498041 IP localhost.localdomain > 192.168.0.3: ICMP echo request, id 14764, seq 101, length 64
09:51:54.497826 IP localhost.localdomain > 192.168.0.3: ICMP echo request, id 14764, seq 102, length 64
09:51:55.497710 IP localhost.localdomain > 192.168.0.3: ICMP echo request, id 14764, seq 103, length 64
09:51:56.498053 IP localhost.localdomain > 192.168.0.3: ICMP echo request, id 14764, seq 104, length 64
09:51:57.498704 IP localhost.localdomain > 192.168.0.3: ICMP echo request, id 14764, seq 105, length 64
09:51:58.499002 IP localhost.localdomain > 192.168.0.3: ICMP echo request, id 14764, seq 106, length 64
09:51:59.454528 IP 192.168.0.3 > 43.229.64.40: ICMP echo request, id 1, seq 1356, length 40
09:51:59.455047 IP web.setup > 192.168.0.3: ICMP time exceeded in-transit, length 36
09:51:59.485638 IP 192.168.0.3 > 43.229.64.40: ICMP echo request, id 1, seq 1357, length 40
09:51:59.486043 IP web.setup > 192.168.0.3: ICMP time exceeded in-transit, length 36
09:51:59.498704 IP localhost.localdomain > 192.168.0.3: ICMP echo request, id 14764, seq 107, length 64
09:51:59.516784 IP 192.168.0.3 > 43.229.64.40: ICMP echo request, id 1, seq 1358, length 40
09:51:59.517727 IP web.setup > 192.168.0.3: ICMP time exceeded in-transit, length 36
09:51:59.548570 IP 192.168.0.3 > 43.229.64.40: ICMP echo request, id 1, seq 1359, length 40
09:51:59.548964 IP web.setup > 192.168.0.3: ICMP time exceeded in-transit, length 36
09:51:59.586624 IP web.setup > 192.168.0.3: ICMP web.setup udp port netbios-ns unreachable, length 36
09:52:00.499026 IP localhost.localdomain > 192.168.0.3: ICMP echo request, id 14764, seq 108, length 64
09:52:01.086953 IP web.setup > 192.168.0.3: ICMP web.setup udp port netbios-ns unreachable, length 36
09:52:01.498994 IP localhost.localdomain > 192.168.0.3: ICMP echo request, id 14764, seq 109, length 64
09:52:02.498857 IP localhost.localdomain > 192.168.0.3: ICMP echo request, id 14764, seq 110, length 64
09:52:02.588329 IP web.setup > 192.168.0.3: ICMP web.setup udp port netbios-ns unreachable, length 36
09:52:03.498628 IP localhost.localdomain > 192.168.0.3: ICMP echo request, id 14764, seq 111, length 64
09:52:04.087807 IP 192.168.0.3 > 43.229.64.40: ICMP echo request, id 1, seq 1360, length 40
09:52:04.091524 IP KD125054031065.ppp-bb.dion.ne.jp > 192.168.0.3: ICMP time exceeded in-transit, length 36
09:52:04.122195 IP 192.168.0.3 > 43.229.64.40: ICMP echo request, id 1, seq 1361, length 40
09:52:04.125094 IP KD125054031065.ppp-bb.dion.ne.jp > 192.168.0.3: ICMP time exceeded in-transit, length 36
09:52:04.155419 IP 192.168.0.3 > 43.229.64.40: ICMP echo request, id 1, seq 1362, length 40
09:52:04.158869 IP KD125054031065.ppp-bb.dion.ne.jp > 192.168.0.3: ICMP time exceeded in-transit, length 36
09:52:04.189530 IP 192.168.0.3 > 43.229.64.40: ICMP echo request, id 1, seq 1363, length 40
09:52:04.192299 IP KD125054031065.ppp-bb.dion.ne.jp > 192.168.0.3: ICMP time exceeded in-transit, length 36
09:52:04.223026 IP 192.168.0.3 > 43.229.64.40: ICMP echo request, id 1, seq 1364, length 40
09:52:04.224647 IP sjk-KAPhatgydai2ML02.bb.kddi.ne.jp > 192.168.0.3: ICMP time exceeded in-transit, length 36
09:52:04.255328 IP 192.168.0.3 > 43.229.64.40: ICMP echo request, id 1, seq 1365, length 40
09:52:04.257664 IP sjk-KAPhatgydai2ML02.bb.kddi.ne.jp > 192.168.0.3: ICMP time exceeded in-transit, length 36
09:52:04.288317 IP 192.168.0.3 > 43.229.64.40: ICMP echo request, id 1, seq 1366, length 40
09:52:04.290867 IP sjk-KAPhatgydai2ML02.bb.kddi.ne.jp > 192.168.0.3: ICMP time exceeded in-transit, length 36
09:52:04.321330 IP 192.168.0.3 > 43.229.64.40: ICMP echo request, id 1, seq 1367, length 40
09:52:04.322680 IP sjk-KAPhatgydai2ML02.bb.kddi.ne.jp > 192.168.0.3: ICMP time exceeded in-transit, length 36
09:52:04.353369 IP 192.168.0.3 > 43.229.64.40: ICMP echo request, id 1, seq 1368, length 40
09:52:04.355542 IP stmBBML302.bb.kddi.ne.jp > 192.168.0.3: ICMP time exceeded in-transit, length 36
09:52:04.386143 IP 192.168.0.3 > 43.229.64.40: ICMP echo request, id 1, seq 1369, length 40
09:52:04.388545 IP stmBBML302.bb.kddi.ne.jp > 192.168.0.3: ICMP time exceeded in-transit, length 36
09:52:04.418914 IP 192.168.0.3 > 43.229.64.40: ICMP echo request, id 1, seq 1370, length 40
09:52:04.420773 IP stmBBML302.bb.kddi.ne.jp > 192.168.0.3: ICMP time exceeded in-transit, length 36
09:52:04.451544 IP 192.168.0.3 > 43.229.64.40: ICMP echo request, id 1, seq 1371, length 40
09:52:04.453558 IP stmBBML302.bb.kddi.ne.jp > 192.168.0.3: ICMP time exceeded in-transit, length 36
09:52:04.484774 IP 192.168.0.3 > 43.229.64.40: ICMP echo request, id 1, seq 1372, length 40
09:52:04.490075 IP sjkBBAC08.bb.kddi.ne.jp > 192.168.0.3: ICMP time exceeded in-transit, length 76
09:52:04.498692 IP localhost.localdomain > 192.168.0.3: ICMP echo request, id 14764, seq 112, length 64
09:52:04.520757 IP 192.168.0.3 > 43.229.64.40: ICMP echo request, id 1, seq 1373, length 40
09:52:04.526366 IP sjkBBAC08.bb.kddi.ne.jp > 192.168.0.3: ICMP time exceeded in-transit, length 76
09:52:04.556866 IP 192.168.0.3 > 43.229.64.40: ICMP echo request, id 1, seq 1374, length 40
09:52:04.562701 IP sjkBBAC08.bb.kddi.ne.jp > 192.168.0.3: ICMP time exceeded in-transit, length 76
09:52:04.593274 IP 192.168.0.3 > 43.229.64.40: ICMP echo request, id 1, seq 1375, length 40
09:52:04.599621 IP sjkBBAC08.bb.kddi.ne.jp > 192.168.0.3: ICMP time exceeded in-transit, length 76
09:52:04.637738 IP 192.168.0.3 > 43.229.64.40: ICMP echo request, id 1, seq 1376, length 40
09:52:04.644387 IP 27.80.241.121 > 192.168.0.3: ICMP time exceeded in-transit, length 76
09:52:04.675008 IP 192.168.0.3 > 43.229.64.40: ICMP echo request, id 1, seq 1377, length 40
09:52:04.680954 IP 27.80.241.121 > 192.168.0.3: ICMP time exceeded in-transit, length 76
09:52:04.712011 IP 192.168.0.3 > 43.229.64.40: ICMP echo request, id 1, seq 1378, length 40
09:52:04.720788 IP 27.80.241.121 > 192.168.0.3: ICMP time exceeded in-transit, length 76
09:52:04.751485 IP 192.168.0.3 > 43.229.64.40: ICMP echo request, id 1, seq 1379, length 40
09:52:04.758192 IP 27.80.241.121 > 192.168.0.3: ICMP time exceeded in-transit, length 76
09:52:04.795391 IP 192.168.0.3 > 43.229.64.40: ICMP echo request, id 1, seq 1380, length 40
09:52:04.800387 IP 27.85.133.218 > 192.168.0.3: ICMP time exceeded in-transit, length 36
09:52:04.831034 IP 192.168.0.3 > 43.229.64.40: ICMP echo request, id 1, seq 1381, length 40
09:52:04.836873 IP 27.85.133.218 > 192.168.0.3: ICMP time exceeded in-transit, length 36
09:52:04.867473 IP 192.168.0.3 > 43.229.64.40: ICMP echo request, id 1, seq 1382, length 40
09:52:04.872637 IP 27.85.133.218 > 192.168.0.3: ICMP time exceeded in-transit, length 36
09:52:04.903510 IP 192.168.0.3 > 43.229.64.40: ICMP echo request, id 1, seq 1383, length 40
09:52:04.908670 IP 27.85.133.218 > 192.168.0.3: ICMP time exceeded in-transit, length 36
09:52:04.946858 IP 192.168.0.3 > 43.229.64.40: ICMP echo request, id 1, seq 1384, length 40
09:52:04.951547 IP 211.122.27.213 > 192.168.0.3: ICMP time exceeded in-transit, length 36
09:52:04.982273 IP 192.168.0.3 > 43.229.64.40: ICMP echo request, id 1, seq 1385, length 40
09:52:04.986798 IP 211.122.27.213 > 192.168.0.3: ICMP time exceeded in-transit, length 36
09:52:05.017191 IP 192.168.0.3 > 43.229.64.40: ICMP echo request, id 1, seq 1386, length 40
09:52:05.114096 IP 211.122.27.213 > 192.168.0.3: ICMP time exceeded in-transit, length 36
09:52:05.144810 IP 192.168.0.3 > 43.229.64.40: ICMP echo request, id 1, seq 1387, length 40
09:52:05.149866 IP 211.122.27.213 > 192.168.0.3: ICMP time exceeded in-transit, length 36
09:52:05.186425 IP 192.168.0.3 > 43.229.64.40: ICMP echo request, id 1, seq 1388, length 40
09:52:05.207461 IP 60.37.54.157 > 192.168.0.3: ICMP time exceeded in-transit, length 36
09:52:05.238863 IP 192.168.0.3 > 43.229.64.40: ICMP echo request, id 1, seq 1389, length 40
09:52:05.260238 IP 60.37.54.157 > 192.168.0.3: ICMP time exceeded in-transit, length 36
09:52:05.290827 IP 192.168.0.3 > 43.229.64.40: ICMP echo request, id 1, seq 1390, length 40
09:52:05.307230 IP 60.37.54.157 > 192.168.0.3: ICMP time exceeded in-transit, length 36
09:52:05.337895 IP 192.168.0.3 > 43.229.64.40: ICMP echo request, id 1, seq 1391, length 40
09:52:05.353924 IP 60.37.54.157 > 192.168.0.3: ICMP time exceeded in-transit, length 36
09:52:05.390015 IP 192.168.0.3 > 43.229.64.40: ICMP echo request, id 1, seq 1392, length 40
09:52:05.407312 IP 122.28.104.194 > 192.168.0.3: ICMP time exceeded in-transit, length 36
09:52:05.437984 IP 192.168.0.3 > 43.229.64.40: ICMP echo request, id 1, seq 1393, length 40
09:52:05.443331 IP 122.28.104.194 > 192.168.0.3: ICMP time exceeded in-transit, length 36
09:52:05.473953 IP 192.168.0.3 > 43.229.64.40: ICMP echo request, id 1, seq 1394, length 40
09:52:05.479601 IP 122.28.104.194 > 192.168.0.3: ICMP time exceeded in-transit, length 36
09:52:05.498957 IP localhost.localdomain > 192.168.0.3: ICMP echo request, id 14764, seq 113, length 64
09:52:05.510465 IP 192.168.0.3 > 43.229.64.40: ICMP echo request, id 1, seq 1395, length 40
09:52:05.515600 IP 122.28.104.194 > 192.168.0.3: ICMP time exceeded in-transit, length 36
09:52:05.552032 IP 192.168.0.3 > 43.229.64.40: ICMP echo request, id 1, seq 1396, length 40
09:52:05.563430 IP 210.163.230.90 > 192.168.0.3: ICMP time exceeded in-transit, length 36
09:52:05.594596 IP 192.168.0.3 > 43.229.64.40: ICMP echo request, id 1, seq 1397, length 40
09:52:05.606764 IP 210.163.230.90 > 192.168.0.3: ICMP time exceeded in-transit, length 36
09:52:05.637594 IP 192.168.0.3 > 43.229.64.40: ICMP echo request, id 1, seq 1398, length 40
09:52:05.716057 IP 210.163.230.90 > 192.168.0.3: ICMP time exceeded in-transit, length 36
09:52:05.747046 IP 192.168.0.3 > 43.229.64.40: ICMP echo request, id 1, seq 1399, length 40
09:52:05.792237 IP 210.163.230.90 > 192.168.0.3: ICMP time exceeded in-transit, length 36
09:52:05.830344 IP 192.168.0.3 > 43.229.64.40: ICMP echo request, id 1, seq 1400, length 40
09:52:05.838060 IP ae-15.r27.tokyjp05.jp.bb.gin.ntt.net > 192.168.0.3: ICMP time exceeded in-transit, length 36
09:52:05.868678 IP 192.168.0.3 > 43.229.64.40: ICMP echo request, id 1, seq 1401, length 40
09:52:05.880807 IP ae-15.r26.tokyjp05.jp.bb.gin.ntt.net > 192.168.0.3: ICMP time exceeded in-transit, length 36
09:52:05.911362 IP 192.168.0.3 > 43.229.64.40: ICMP echo request, id 1, seq 1402, length 40
09:52:05.916776 IP ae-15.r26.tokyjp05.jp.bb.gin.ntt.net > 192.168.0.3: ICMP time exceeded in-transit, length 36
09:52:05.947421 IP 192.168.0.3 > 43.229.64.40: ICMP echo request, id 1, seq 1403, length 40
09:52:05.952269 IP ae-15.r26.tokyjp05.jp.bb.gin.ntt.net > 192.168.0.3: ICMP time exceeded in-transit, length 36
09:52:05.988233 IP 192.168.0.3 > 43.229.64.40: ICMP echo request, id 1, seq 1404, length 40
09:52:05.995515 IP ae-0.r30.tokyjp05.jp.bb.gin.ntt.net > 192.168.0.3: ICMP time exceeded in-transit, length 148
09:52:06.025976 IP 192.168.0.3 > 43.229.64.40: ICMP echo request, id 1, seq 1405, length 40
09:52:06.032475 IP ae-2.r31.tokyjp05.jp.bb.gin.ntt.net > 192.168.0.3: ICMP time exceeded in-transit, length 148
09:52:06.063202 IP 192.168.0.3 > 43.229.64.40: ICMP echo request, id 1, seq 1406, length 40
09:52:06.073216 IP ae-0.r30.tokyjp05.jp.bb.gin.ntt.net > 192.168.0.3: ICMP time exceeded in-transit, length 148
09:52:06.103938 IP 192.168.0.3 > 43.229.64.40: ICMP echo request, id 1, seq 1407, length 40
09:52:06.117390 IP ae-0.r30.tokyjp05.jp.bb.gin.ntt.net > 192.168.0.3: ICMP time exceeded in-transit, length 148
09:52:06.148113 IP 192.168.0.3 > 43.229.64.40: ICMP echo request, id 1, seq 1408, length 40
09:52:06.155290 IP ae-6.r02.tokyjp03.jp.bb.gin.ntt.net > 192.168.0.3: ICMP time exceeded in-transit, length 76
09:52:06.186011 IP 192.168.0.3 > 43.229.64.40: ICMP echo request, id 1, seq 1409, length 40
09:52:06.193920 IP ae-6.r02.tokyjp03.jp.bb.gin.ntt.net > 192.168.0.3: ICMP time exceeded in-transit, length 76
09:52:06.224541 IP 192.168.0.3 > 43.229.64.40: ICMP echo request, id 1, seq 1410, length 40
09:52:06.231508 IP ae-6.r02.tokyjp03.jp.bb.gin.ntt.net > 192.168.0.3: ICMP time exceeded in-transit, length 76
09:52:06.262068 IP 192.168.0.3 > 43.229.64.40: ICMP echo request, id 1, seq 1411, length 40
09:52:06.277854 IP ae-17.r00.tokyjp03.jp.bb.gin.ntt.net > 192.168.0.3: ICMP time exceeded in-transit, length 76
09:52:06.309009 IP 192.168.0.3 > 43.229.64.40: ICMP echo request, id 1, seq 1412, length 40
09:52:06.314936 IP xe-0-3-0-1.r02.tokyjp03.jp.ce.gin.ntt.net > 192.168.0.3: ICMP time exceeded in-transit, length 36
09:52:06.346273 IP 192.168.0.3 > 43.229.64.40: ICMP echo request, id 1, seq 1413, length 40
09:52:06.352537 IP xe-0-3-0-1.r02.tokyjp03.jp.ce.gin.ntt.net > 192.168.0.3: ICMP time exceeded in-transit, length 36
09:52:06.382909 IP 192.168.0.3 > 43.229.64.40: ICMP echo request, id 1, seq 1414, length 40
09:52:06.388700 IP xe-0-3-0-8.r00.tokyjp03.jp.ce.gin.ntt.net > 192.168.0.3: ICMP time exceeded in-transit, length 36
09:52:06.419216 IP 192.168.0.3 > 43.229.64.40: ICMP echo request, id 1, seq 1415, length 40
09:52:06.425137 IP xe-0-3-0-1.r02.tokyjp03.jp.ce.gin.ntt.net > 192.168.0.3: ICMP time exceeded in-transit, length 36
09:52:06.462680 IP 192.168.0.3 > 43.229.64.40: ICMP echo request, id 1, seq 1416, length 40
09:52:06.498738 IP localhost.localdomain > 192.168.0.3: ICMP echo request, id 14764, seq 114, length 64
09:52:07.499108 IP localhost.localdomain > 192.168.0.3: ICMP echo request, id 14764, seq 115, length 64
09:52:08.498835 IP localhost.localdomain > 192.168.0.3: ICMP echo request, id 14764, seq 116, length 64
09:52:09.498845 IP localhost.localdomain > 192.168.0.3: ICMP echo request, id 14764, seq 117, length 64
09:52:10.498671 IP localhost.localdomain > 192.168.0.3: ICMP echo request, id 14764, seq 118, length 64
09:52:11.261845 IP 192.168.0.3 > 43.229.64.40: ICMP echo request, id 1, seq 1417, length 40
09:52:11.499004 IP localhost.localdomain > 192.168.0.3: ICMP echo request, id 14764, seq 119, length 64
09:52:12.498894 IP localhost.localdomain > 192.168.0.3: ICMP echo request, id 14764, seq 120, length 64
09:52:13.498868 IP localhost.localdomain > 192.168.0.3: ICMP echo request, id 14764, seq 121, length 64
09:52:14.498719 IP localhost.localdomain > 192.168.0.3: ICMP echo request, id 14764, seq 122, length 64
09:52:15.499858 IP localhost.localdomain > 192.168.0.3: ICMP echo request, id 14764, seq 123, length 64
09:52:16.261845 IP 192.168.0.3 > 43.229.64.40: ICMP echo request, id 1, seq 1418, length 40
09:52:16.499749 IP localhost.localdomain > 192.168.0.3: ICMP echo request, id 14764, seq 124, length 64
09:52:17.500013 IP localhost.localdomain > 192.168.0.3: ICMP echo request, id 14764, seq 125, length 64
09:52:18.500052 IP localhost.localdomain > 192.168.0.3: ICMP echo request, id 14764, seq 126, length 64
09:52:19.499812 IP localhost.localdomain > 192.168.0.3: ICMP echo request, id 14764, seq 127, length 64
09:52:20.499845 IP localhost.localdomain > 192.168.0.3: ICMP echo request, id 14764, seq 128, length 64
09:52:21.261285 IP 192.168.0.3 > 43.229.64.40: ICMP echo request, id 1, seq 1419, length 40
09:52:21.499913 IP localhost.localdomain > 192.168.0.3: ICMP echo request, id 14764, seq 129, length 64
09:52:22.499954 IP localhost.localdomain > 192.168.0.3: ICMP echo request, id 14764, seq 130, length 64
09:52:23.500006 IP localhost.localdomain > 192.168.0.3: ICMP echo request, id 14764, seq 131, length 64
09:52:24.499703 IP localhost.localdomain > 192.168.0.3: ICMP echo request, id 14764, seq 132, length 64
09:52:25.500046 IP localhost.localdomain > 192.168.0.3: ICMP echo request, id 14764, seq 133, length 64
09:52:26.261656 IP 192.168.0.3 > 43.229.64.40: ICMP echo request, id 1, seq 1420, length 40
09:52:26.499786 IP localhost.localdomain > 192.168.0.3: ICMP echo request, id 14764, seq 134, length 64
09:52:27.499726 IP localhost.localdomain > 192.168.0.3: ICMP echo request, id 14764, seq 135, length 64
09:52:28.499854 IP localhost.localdomain > 192.168.0.3: ICMP echo request, id 14764, seq 136, length 64
09:52:29.500010 IP localhost.localdomain > 192.168.0.3: ICMP echo request, id 14764, seq 137, length 64
09:52:30.500004 IP localhost.localdomain > 192.168.0.3: ICMP echo request, id 14764, seq 138, length 64
09:52:31.261634 IP 192.168.0.3 > 43.229.64.40: ICMP echo request, id 1, seq 1421, length 40
09:52:31.499866 IP localhost.localdomain > 192.168.0.3: ICMP echo request, id 14764, seq 139, length 64
09:52:32.499992 IP localhost.localdomain > 192.168.0.3: ICMP echo request, id 14764, seq 140, length 64
09:52:33.499913 IP localhost.localdomain > 192.168.0.3: ICMP echo request, id 14764, seq 141, length 64
09:52:34.499731 IP localhost.localdomain > 192.168.0.3: ICMP echo request, id 14764, seq 142, length 64
09:52:35.499628 IP localhost.localdomain > 192.168.0.3: ICMP echo request, id 14764, seq 143, length 64
09:52:36.261389 IP 192.168.0.3 > 43.229.64.40: ICMP echo request, id 1, seq 1422, length 40
09:52:36.499662 IP localhost.localdomain > 192.168.0.3: ICMP echo request, id 14764, seq 144, length 64
09:52:37.499742 IP localhost.localdomain > 192.168.0.3: ICMP echo request, id 14764, seq 145, length 64
09:52:38.500038 IP localhost.localdomain > 192.168.0.3: ICMP echo request, id 14764, seq 146, length 64
09:52:39.500095 IP localhost.localdomain > 192.168.0.3: ICMP echo request, id 14764, seq 147, length 64
09:52:40.499867 IP localhost.localdomain > 192.168.0.3: ICMP echo request, id 14764, seq 148, length 64
09:52:41.261778 IP 192.168.0.3 > 43.229.64.40: ICMP echo request, id 1, seq 1423, length 40
09:52:41.499706 IP localhost.localdomain > 192.168.0.3: ICMP echo request, id 14764, seq 149, length 64
09:52:42.499710 IP localhost.localdomain > 192.168.0.3: ICMP echo request, id 14764, seq 150, length 64
09:52:43.499993 IP localhost.localdomain > 192.168.0.3: ICMP echo request, id 14764, seq 151, length 64
09:52:44.499912 IP localhost.localdomain > 192.168.0.3: ICMP echo request, id 14764, seq 152, length 64
09:52:45.500624 IP localhost.localdomain > 192.168.0.3: ICMP echo request, id 14764, seq 153, length 64
09:52:46.262263 IP 192.168.0.3 > 43.229.64.40: ICMP echo request, id 1, seq 1424, length 40
09:52:46.500774 IP localhost.localdomain > 192.168.0.3: ICMP echo request, id 14764, seq 154, length 64
09:52:47.500995 IP localhost.localdomain > 192.168.0.3: ICMP echo request, id 14764, seq 155, length 64
09:52:48.500802 IP localhost.localdomain > 192.168.0.3: ICMP echo request, id 14764, seq 156, length 64
09:52:49.501126 IP localhost.localdomain > 192.168.0.3: ICMP echo request, id 14764, seq 157, length 64
09:52:50.500964 IP localhost.localdomain > 192.168.0.3: ICMP echo request, id 14764, seq 158, length 64
09:52:51.261932 IP 192.168.0.3 > 43.229.64.40: ICMP echo request, id 1, seq 1425, length 40
09:52:51.500922 IP localhost.localdomain > 192.168.0.3: ICMP echo request, id 14764, seq 159, length 64
09:52:52.500717 IP localhost.localdomain > 192.168.0.3: ICMP echo request, id 14764, seq 160, length 64
09:52:53.500725 IP localhost.localdomain > 192.168.0.3: ICMP echo request, id 14764, seq 161, length 64
09:52:54.500816 IP localhost.localdomain > 192.168.0.3: ICMP echo request, id 14764, seq 162, length 64
09:52:55.500752 IP localhost.localdomain > 192.168.0.3: ICMP echo request, id 14764, seq 163, length 64
09:52:56.261510 IP 192.168.0.3 > 43.229.64.40: ICMP echo request, id 1, seq 1426, length 40
09:52:56.500942 IP localhost.localdomain > 192.168.0.3: ICMP echo request, id 14764, seq 164, length 64
09:52:57.500635 IP localhost.localdomain > 192.168.0.3: ICMP echo request, id 14764, seq 165, length 64
09:52:58.500703 IP localhost.localdomain > 192.168.0.3: ICMP echo request, id 14764, seq 166, length 64
09:52:59.500604 IP localhost.localdomain > 192.168.0.3: ICMP echo request, id 14764, seq 167, length 64
09:53:00.500625 IP localhost.localdomain > 192.168.0.3: ICMP echo request, id 14764, seq 168, length 64
09:53:01.261522 IP 192.168.0.3 > 43.229.64.40: ICMP echo request, id 1, seq 1427, length 40
09:53:01.500724 IP localhost.localdomain > 192.168.0.3: ICMP echo request, id 14764, seq 169, length 64
09:53:02.500622 IP localhost.localdomain > 192.168.0.3: ICMP echo request, id 14764, seq 170, length 64
